f1c73b80 428533012 S Co:1:032:0 s 40 a0 7f92 0000 0001 1 = 01
f1c73b80 428534340 C Co:1:032:0 0 1 >
f482e400 428538044 S Co:1:032:0 s 40 a0 e600 0000 0001 1 = 01
f482e400 428538963 C Co:1:032:0 0 1 >
f482ee80 428546677 S Co:1:032:0 s 40 a0 7f92 0000 0001 1 = 01
f482ee80 428547339 C Co:1:032:0 0 1 >
f4f72500 428560490 S Co:1:032:0 s 40 a0 e600 0000 0001 1 = 01
f4f72500 428561341 C Co:1:032:0 0 1 >
f4f72500 428565164 S Co:1:032:0 s 40 a0 0368 0000 0010 16 = 90e668e0 ff74fff0 e0b40b04 eff0d322
f4f72500 428565211 C Co:1:032:0 0 16 >
f4f72e80 428568161 S Co:1:032:0 s 40 a0 0378 0000 0006 6 = 90e668ef f0c3
f4f72e80 428568213 C Co:1:032:0 0 6 >
f4f72e80 428570981 S Co:1:032:0 s 40 a0 037e 0000 0001 1 = 22
f4f72e80 428571711 C Co:1:032:0 0 1 >
f4f72e80 428576055 S Co:1:032:0 s 40 a0 01b5 0000 0010 16 = 907fe9e0 64a36003 0202c5a3 e0750800
f4f72e80 428577095 C Co:1:032:0 0 16 >
f4f72e80 428580492 S Co:1:032:0 s 40 a0 01c5 0000 0010 16 = f509a3e0 fee4ee42 08907fee e0750a00
f4f72e80 428581340 C Co:1:032:0 0 16 >
f4f72e80 428583516 S Co:1:032:0 s 40 a0 01d5 0000 0010 16 = f50ba3e0 fee4ee42 0a907fe8 e0644070
f4f72e80 428583592 C Co:1:032:0 0 16 >
f4f72e80 428586540 S Co:1:032:0 s 40 a0 01e5 0000 0010 16 = 64e50b45 0a700302 02d6e490 7fc5f090
f4f72e80 428586592 C Co:1:032:0 0 16 >
c2f17d00 428593738 S Co:1:032:0 s 40 a0 01f5 0000 0010 16 = 7fb4e020 e3f9907f c5e0750c 00f50de4
c2f17d00 428594340 C Co:1:032:0 0 16 >
c2f17a80 428600194 S Co:1:032:0 s 40 a0 0205 0000 0010 16 = fcfdc3ed 950dec95 0c501f74 c02df582
c2f17a80 428601334 C Co:1:032:0 0 16 >
f4ba9d00 428605237 S Co:1:032:0 s 40 a0 0215 0000 0010 16 = e4347ef5 83e0ffe5 092df582 e5083cf5
f4ba9d00 428605339 C Co:1:032:0 0 16 >
f4ba9200 428608179 S Co:1:032:0 s 40 a0 0225 0000 0010 16 = 83eff00d bd00010c 80d8e50d 2509f509
f4ba9200 428608334 C Co:1:032:0 0 16 >
f4ba9200 428611202 S Co:1:032:0 s 40 a0 0235 0000 0010 16 = e50c3508 f508c3e5 0b950df5 0be50a95
f4ba9200 428611334 C Co:1:032:0 0 16 >
f4ba9d00 428614224 S Co:1:032:0 s 40 a0 0245 0000 0010 16 = 0cf50a80 9c907fe8 e064c060 030202d6
f4ba9d00 428614336 C Co:1:032:0 0 16 >
f4ba9d00 428617254 S Co:1:032:0 s 40 a0 0255 0000 0010 16 = e50b450a 607bc3e5 0b9440e5 0a940050
f4ba9d00 428617340 C Co:1:032:0 0 16 >
f4ba9500 428624188 S Co:1:032:0 s 40 a0 0265 0000 0010 16 = 08850a0c 850b0d80 06750c00 750d40e4
f4ba9500 428624334 C Co:1:032:0 0 16 >
f4ba9500 428627160 S Co:1:032:0 s 40 a0 0275 0000 0010 16 = fcfdc3ed 950dec95 0c501fe5 092df582
f4ba9500 428627211 C Co:1:032:0 0 16 >
f0686b80 428633228 S Co:1:032:0 s 40 a0 0285 0000 0010 16 = e5083cf5 83e0ff74 002df582 e4347ff5
f0686b80 428634335 C Co:1:032:0 0 16 >
f0686b80 428636152 S Co:1:032:0 s 40 a0 0295 0000 0010 16 = 83eff00d bd00010c 80d8907f b5e50df0
f0686b80 428638711 C Co:1:032:0 0 16 >
f0686000 428653350 S Co:1:032:0 s 40 a0 02a5 0000 0010 16 = 2509f509 e50c3508 f508c3e5 0b950df5
f0686000 428654337 C Co:1:032:0 0 16 >
f0686000 428664526 S Co:1:032:0 s 40 a0 02b5 0000 0010 16 = 0be50a95 0cf50a90 7fb4e030 e29280f7
f0686000 428665341 C Co:1:032:0 0 16 >
f0686880 428667254 S Co:1:032:0 s 40 a0 02c5 0000 0010 16 = 907fe9e0 b4ac0ae4 907f00f0 907fb504
f0686880 428667338 C Co:1:032:0 0 16 >
f0686280 428670260 S Co:1:032:0 s 40 a0 02d5 0000 0008 8 = f0907fb4 e04402f0
f0686280 428670611 C Co:1:032:0 0 8 >
f5649a00 428675926 S Co:1:032:0 s 40 a0 02dd 0000 0001 1 = 22
f5649a00 428679334 C Co:1:032:0 0 1 >
f1c73d00 428684403 S Co:1:032:0 s 40 a0 0080 0000 0010 16 = 90e6b9e0 64a36003 020198a3 e0750800
f1c73d00 428684586 C Co:1:032:0 0 16 >
f542b700 428689612 S Co:1:032:0 s 40 a0 0090 0000 0010 16 = f509a3e0 fee4ee42 0890e6be e0750a00
f542b700 428689711 C Co:1:032:0 0 16 >
f4a34100 428692125 S Co:1:032:0 s 40 a0 00a0 0000 0010 16 = f50ba3e0 fee4ee42 0a90e6b8 e0644070
f4a34100 428694227 C Co:1:032:0 0 16 >
c2689d00 428698011 S Co:1:032:0 s 40 a0 00b0 0000 0010 16 = 66e50b45 0a700302 01ade490 e68af0a3
c2689d00 428698084 C Co:1:032:0 0 16 >
c2689400 428701335 S Co:1:032:0 s 40 a0 00c0 0000 0010 16 = f090e6a0 e020e1f9 90e68be0 750c00f5
c2689400 428701460 C Co:1:032:0 0 16 >
c2689400 428705204 S Co:1:032:0 s 40 a0 00d0 0000 0010 16 = 0de4fcfd c3ed950d ec950c50 1f74402d
c2689400 428705337 C Co:1:032:0 0 16 >
c2689400 428707705 S Co:1:032:0 s 40 a0 00e0 0000 0010 16 = f582e434 e7f583e0 ffe5092d f582e508
c2689400 428707834 C Co:1:032:0 0 16 >
f4e6fe00 428714094 S Co:1:032:0 s 40 a0 00f0 0000 0010 16 = 3cf583ef f00dbd00 010c80d8 e50d2509
f4e6fe00 428715334 C Co:1:032:0 0 16 >
f4e6ff80 428718546 S Co:1:032:0 s 40 a0 0100 0000 0010 16 = f509e50c 3508f508 c3e50b95 0df50be5
f4e6ff80 428718709 C Co:1:032:0 0 16 >
f4e6ff00 428728208 S Co:1:032:0 s 40 a0 0110 0000 0010 16 = 0a950cf5 0a809a90 e6b8e064 c0600302
f4e6ff00 428729336 C Co:1:032:0 0 16 >
f4e6ff00 428732745 S Co:1:032:0 s 40 a0 0120 0000 0010 16 = 01ade50b 450a7003 0201adc3 e50b9440
f4e6ff00 428732835 C Co:1:032:0 0 16 >
f4e6ff00 428736942 S Co:1:032:0 s 40 a0 0130 0000 0010 16 = e50a9400 5008850a 0c850b0d 8006750c
f4e6ff00 428737084 C Co:1:032:0 0 16 >
c2406b80 428739382 S Co:1:032:0 s 40 a0 0140 0000 0010 16 = 00750d40 e4fcfdc3 ed950dec 950c501f
c2406b80 428740209 C Co:1:032:0 0 16 >
c2406e80 428742405 S Co:1:032:0 s 40 a0 0150 0000 0010 16 = e5092df5 82e5083c f583e0ff 74402df5
c2406e80 428742461 C Co:1:032:0 0 16 >
c2406280 428745428 S Co:1:032:0 s 40 a0 0160 0000 0010 16 = 82e434e7 f583eff0 0dbd0001 0c80d8e4
c2406280 428745585 C Co:1:032:0 0 16 >
c2406b80 428748375 S Co:1:032:0 s 40 a0 0170 0000 0010 16 = 90e68af0 a3e50df0 2509f509 e50c3508
c2406b80 428748459 C Co:1:032:0 0 16 >
c2406b80 428751398 S Co:1:032:0 s 40 a0 0180 0000 0010 16 = f508c3e5 0b950df5 0be50a95 0cf50a90
c2406b80 428752085 C Co:1:032:0 0 16 >
c2406880 428754463 S Co:1:032:0 s 40 a0 0190 0000 0010 16 = e6a0e030 e18c80f7 90e6b9e0 b4ac0e90
c2406880 428756461 C Co:1:032:0 0 16 >
c2406300 428759897 S Co:1:032:0 s 40 a0 01a0 0000 0010 16 = e7407401 f0e490e6 8af0a304 f090e6a0
c2406300 428759966 C Co:1:032:0 0 16 >
c2406300 428762929 S Co:1:032:0 s 40 a0 01b0 0000 0004 4 = e04480f0
c2406300 428764336 C Co:1:032:0 0 4 >
c2406200 428767959 S Co:1:032:0 s 40 a0 01b4 0000 0001 1 = 22
c2406200 428768085 C Co:1:032:0 0 1 >
c2406500 428771310 S Co:1:032:0 s 40 a0 02de 0000 0010 16 = c2011203 68920090 7f95e044 c0f0d2e8
c2406500 428771461 C Co:1:032:0 0 16 >
c2406500 428774755 S Co:1:032:0 s 40 a0 02ee 0000 0010 16 = 30000890 e65d74ff f0800690 7fab74ff
c2406500 428775459 C Co:1:032:0 0 16 >
c2406200 428778887 S Co:1:032:0 s 40 a0 02fe 0000 0010 16 = f0300008 90e66874 08f08007 907fafe0
c2406200 428779710 C Co:1:032:0 0 16 >
c2406200 428781907 S Co:1:032:0 s 40 a0 030e 0000 0010 16 = 4401f030 000890e6 5c7401f0 8006907f
c2406200 428782710 C Co:1:032:0 0 16 >
c2406400 428785159 S Co:1:032:0 s 40 a0 031e 0000 0010 16 = ae7401f0 d2af3001 fd300005 12008080
c2406400 428785959 C Co:1:032:0 0 16 >
c2406200 428789900 S Co:1:032:0 s 40 a0 032e 0000 0008 8 = 031201b5 c20180ee
c2406200 428789959 C Co:1:032:0 0 8 >
c2406d00 428793072 S Co:1:032:0 s 40 a0 0003 0000 0003 3 = 020336
c2406d00 428793209 C Co:1:032:0 0 3 >
c2406d00 428795938 S Co:1:032:0 s 40 a0 0336 0000 0010 16 = c0e0c083 c082c085 c084c086 758600d2
c2406d00 428796584 C Co:1:032:0 0 16 >
c2406180 428801242 S Co:1:032:0 s 40 a0 0346 0000 0010 16 = 015391ef 30000890 e65d7401 f0800690
c2406180 428803335 C Co:1:032:0 0 16 >
c2406180 428805734 S Co:1:032:0 s 40 a0 0356 0000 0010 16 = 7fab7401 f0d086d0 84d085d0 82d083d0
c2406180 428806590 C Co:1:032:0 0 16 >
c2406180 428808681 S Co:1:032:0 s 40 a0 0366 0000 0002 2 = e032
c2406180 428809837 C Co:1:032:0 0 2 >
c2406180 428821206 S Co:1:032:0 s 40 a0 0043 0000 0003 3 = 020400
c2406180 428823338 C Co:1:032:0 0 3 >
c2406180 428827798 S Co:1:032:0 s 40 a0 0400 0000 0004 4 = 02033600
c2406180 428827837 C Co:1:032:0 0 4 >
c2406180 428832975 S Co:1:032:0 s 40 a0 0000 0000 0003 3 = 02037f
c2406180 428834336 C Co:1:032:0 0 3 >
c2406180 428837802 S Co:1:032:0 s 40 a0 037f 0000 000c 12 = 787fe4f6 d8fd7581 200202de
c2406180 428838585 C Co:1:032:0 0 12 >
c2406e80 428842653 S Co:1:032:0 s 40 a0 7f92 0000 0001 1 = 00
c2406e80 428845334 C Co:1:032:0 0 1 >
c2406e80 428847780 S Co:1:032:0 s 40 a0 e600 0000 0001 1 = 00
c2406e80 428847835 C Co:1:032:0 0 1 >
