c2406100 428853529 S Co:1:032:0 s 40 a0 7f92 0000 0001 1 = 01
c2406100 428855335 C Co:1:032:0 0 1 >
c2406100 428858488 S Co:1:032:0 s 40 a0 e600 0000 0001 1 = 01
c2406100 428858584 C Co:1:032:0 0 1 >
c2406e80 428873733 S Co:1:032:0 s 40 a0 0066 0000 0010 16 = 12010002 00000040 56181200 00000102
c2406e80 428878339 C Co:1:032:0 0 16 >
c2406e80 428885390 S Co:1:032:0 s 40 a0 0076 0000 0010 16 = 00020a06 00020000 00400100 09022000
c2406e80 428886333 C Co:1:032:0 0 16 >
c2406e80 428902179 S Co:1:032:0 s 40 a0 0086 0000 0010 16 = 01010080 af090400 0002ff00 00000705
c2406e80 428903345 C Co:1:032:0 0 16 >
c2406e80 428911164 S Co:1:032:0 s 40 a0 0096 0000 0010 16 = 01024000 00070582 02000400 09022000
c2406e80 428912337 C Co:1:032:0 0 16 >
c2406e80 428915881 S Co:1:032:0 s 40 a0 00a6 0000 0010 16 = 01010080 af090400 0002ff00 00000705
c2406e80 428915963 C Co:1:032:0 0 16 >
c2406e80 428923170 S Co:1:032:0 s 40 a0 00b6 0000 0010 16 = 01024000 00070582 02400000 04030904
c2406e80 428924338 C Co:1:032:0 0 16 >
c2406e80 428932159 S Co:1:032:0 s 40 a0 00c6 0000 0010 16 = 0c033000 72006900 6f006e00 2a035300
c2406e80 428933334 C Co:1:032:0 0 16 >
c2406e80 428936698 S Co:1:032:0 s 40 a0 00d6 0000 0010 16 = 74006100 72005300 68006f00 6f007400
c2406e80 428936835 C Co:1:032:0 0 16 >
c2406e80 428945201 S Co:1:032:0 s 40 a0 00e6 0000 0010 16 = 20004100 75007400 6f006700 75006900
c2406e80 428946335 C Co:1:032:0 0 16 >
c2406e80 428953679 S Co:1:032:0 s 40 a0 00f6 0000 0006 6 = 64006500 7200
c2406e80 428954334 C Co:1:032:0 0 6 >
c2406e80 428956697 S Co:1:032:0 s 40 a0 0200 0000 0004 4 = 0202c632
c2406e80 428956834 C Co:1:032:0 0 4 >
c2406e80 428964181 S Co:1:032:0 s 40 a0 020b 0000 0001 1 = 32
c2406e80 428965335 C Co:1:032:0 0 1 >
c2406e80 428969274 S Co:1:032:0 s 40 a0 0213 0000 0001 1 = 32
c2406e80 428969460 C Co:1:032:0 0 1 >
c2406e80 428971660 S Co:1:032:0 s 40 a0 021b 0000 0001 1 = 32
c2406e80 428971834 C Co:1:032:0 0 1 >
c2406e80 428974683 S Co:1:032:0 s 40 a0 0223 0000 0001 1 = 32
c2406e80 428974835 C Co:1:032:0 0 1 >
c2406e80 428985181 S Co:1:032:0 s 40 a0 022b 0000 0001 1 = 32
c2406e80 428986335 C Co:1:032:0 0 1 >
c2406e80 428989634 S Co:1:032:0 s 40 a0 0233 0000 0001 1 = 32
c2406e80 428989710 C Co:1:032:0 0 1 >
c2406100 428992701 S Co:1:032:0 s 40 a0 023b 0000 0001 1 = 32
c2406100 428992834 C Co:1:032:0 0 1 >
c2406100 428995684 S Co:1:032:0 s 40 a0 0243 0000 0001 1 = 32
c2406100 428995835 C Co:1:032:0 0 1 >
c2406100 429006721 S Co:1:032:0 s 40 a0 024b 0000 0001 1 = 32
c2406100 429007336 C Co:1:032:0 0 1 >
c2406100 429009660 S Co:1:032:0 s 40 a0 0253 0000 0001 1 = 32
c2406100 429009709 C Co:1:032:0 0 1 >
c2406100 429012684 S Co:1:032:0 s 40 a0 025b 0000 0001 1 = 32
c2406100 429012834 C Co:1:032:0 0 1 >
c2406100 429015706 S Co:1:032:0 s 40 a0 0263 0000 0001 1 = 32
c2406100 429015836 C Co:1:032:0 0 1 >
c2406100 429020454 S Co:1:032:0 s 40 a0 026b 0000 0003 3 = 0204de
c2406100 429020585 C Co:1:032:0 0 3 >
c2406100 429023482 S Co:1:032:0 s 40 a0 0273 0000 0003 3 = 020533
c2406100 429023585 C Co:1:032:0 0 3 >
c2406100 429029131 S Co:1:032:0 s 40 a0 027b 0000 0003 3 = 020549
c2406100 429030334 C Co:1:032:0 0 3 >
c2406100 429033663 S Co:1:032:0 s 40 a0 0283 0000 0003 3 = 02055f
c2406100 429033834 C Co:1:032:0 0 3 >
c2406100 429039261 S Co:1:032:0 s 40 a0 028b 0000 0003 3 = 020575
c2406100 429040334 C Co:1:032:0 0 3 >
c2406100 429049422 S Co:1:032:0 s 40 a0 0293 0000 0003 3 = 02058b
c2406100 429050336 C Co:1:032:0 0 3 >
c2406100 429054170 S Co:1:032:0 s 40 a0 029b 0000 0003 3 = 0205a1
c2406100 429054211 C Co:1:032:0 0 3 >
c2406100 429057436 S Co:1:032:0 s 40 a0 02a3 0000 0003 3 = 0205b7
c2406100 429058088 C Co:1:032:0 0 3 >
c2406280 429064065 S Co:1:032:0 s 40 a0 02ab 0000 0003 3 = 0205cd
c2406280 429064334 C Co:1:032:0 0 3 >
c2406580 429069712 S Co:1:032:0 s 40 a0 02b3 0000 0003 3 = 0205e3
c2406580 429069836 C Co:1:032:0 0 3 >
c2406700 429073106 S Co:1:032:0 s 40 a0 02bb 0000 0003 3 = 0205f9
c2406700 429073211 C Co:1:032:0 0 3 >
c2406000 429075288 S Co:1:032:0 s 40 a0 02c3 0000 0003 3 = 02060f
c2406000 429075459 C Co:1:032:0 0 3 >
c2406000 429078465 S Co:1:032:0 s 40 a0 032b 0000 0010 16 = 02032e12 033380fe c202c200 c2011208
c2406000 429078584 C Co:1:032:0 0 16 >
c2406000 429081219 S Co:1:032:0 s 40 a0 033b 0000 0010 16 = 03d2e843 d82090e6 5ce0fa44 3df0d2af
c2406000 429082092 C Co:1:032:0 0 16 >
c2406000 429084240 S Co:1:032:0 s 40 a0 034b 0000 0010 16 = d20d1216 4090e680 e0fa54f7 f0538ef8
c2406000 429085085 C Co:1:032:0 0 16 >
c2406000 429090027 S Co:1:032:0 s 40 a0 035b 0000 0010 16 = c202120a 2d300705 12036dc2 07120da3
c2406000 429091335 C Co:1:032:0 0 16 >
c2406080 429094558 S Co:1:032:0 s 40 a0 036b 0000 0010 16 = 80f390e6 b9e0fa24 f4500302 04d5ea2a
c2406080 429096085 C Co:1:032:0 0 16 >
c2406b80 429100044 S Co:1:032:0 s 40 a0 037b 0000 0010 16 = 2a900380 73020488 02047602 04d50204
c2406b80 429102334 C Co:1:032:0 0 16 >
c2406800 429107389 S Co:1:032:0 s 40 a0 038b 0000 0010 16 = 760204d5 0204d502 03a40204 76020480
c2406800 429109336 C Co:1:032:0 0 16 >
c2406880 429112348 S Co:1:032:0 s 40 a0 039b 0000 0010 16 = 02047602 04780204 7690e6bb e0faba01
c2406880 429116334 C Co:1:032:0 0 16 >
c2406800 429119530 S Co:1:032:0 s 40 a0 03ab 0000 0010 16 = 028017ba 02028040 ba030280 67ba0602
c2406800 429120335 C Co:1:032:0 0 16 >
c2406380 429124861 S Co:1:032:0 s 40 a0 03bb 0000 0010 16 = 801fba07 02804702 04d57a66 7b0090e6
c2406380 429126104 C Co:1:032:0 0 16 >
c2406000 429134423 S Co:1:032:0 s 40 a0 03cb 0000 0010 16 = b3ebf07a 667b007b 0090e6b4 eaf00204
c2406000 429135343 C Co:1:032:0 0 16 >
c2406000 429145192 S Co:1:032:0 s 40 a0 03db 0000 0010 16 = d57a787b 0090e6b3 ebf07a78 7b007b00
c2406000 429146336 C Co:1:032:0 0 16 >
c2406000 429149640 S Co:1:032:0 s 40 a0 03eb 0000 0010 16 = 90e6b4ea f00204d5 90e000e0 faa3e0fb
c2406000 429149709 C Co:1:032:0 0 16 >
c2406000 429159214 S Co:1:032:0 s 40 a0 03fb 0000 0010 16 = 90e6b3f0 7b0090e6 b4eaf002 04d590e0
c2406000 429160337 C Co:1:032:0 0 16 >
c2406000 429163738 S Co:1:032:0 s 40 a0 040b 0000 0010 16 = 00e0faa3 e0fb90e6 b3f07b00 90e6b4ea
c2406000 429163835 C Co:1:032:0 0 16 >
c2406000 429166843 S Co:1:032:0 s 40 a0 041b 0000 0010 16 = f00204d5 90e6bae0 fa600dba 0102801f
c2406000 429166961 C Co:1:032:0 0 16 >
c2406000 429169706 S Co:1:032:0 s 40 a0 042b 0000 0010 16 = ba020280 300204d5 7ac27b00 90e6b3eb
c2406000 429169835 C Co:1:032:0 0 16 >
c2406000 429176729 S Co:1:032:0 s 40 a0 043b 0000 0010 16 = f07ac27b 007b0090 e6b4eaf0 0204d57a
c2406000 429177335 C Co:1:032:0 0 16 >
c2406000 429179668 S Co:1:032:0 s 40 a0 044b 0000 0010 16 = c67b0090 e6b3ebf0 7ac67b00 7b0090e6
c2406000 429179836 C Co:1:032:0 0 16 >
c2406000 429184872 S Co:1:032:0 s 40 a0 045b 0000 0010 16 = b4eaf080 757ad27b 0090e6b3 ebf07ad2
c2406000 429184965 C Co:1:032:0 0 16 >
c2406000 429193523 S Co:1:032:0 s 40 a0 046b 0000 0010 16 = 7b007b00 90e6b4ea f0805f80 5d758200
c2406000 429194343 C Co:1:032:0 0 16 >
c2406000 429198181 S Co:1:032:0 s 40 a0 047b 0000 0010 16 = 120ac480 55758201 120ac480 4d90e6b8
c2406000 429198337 C Co:1:032:0 0 16 >
c2406000 429201175 S Co:1:032:0 s 40 a0 048b 0000 0010 16 = e0faba80 02800aba 81028005 ba823b80
c2406000 429201210 C Co:1:032:0 0 16 >
c2406000 429204095 S Co:1:032:0 s 40 a0 049b 0000 0010 16 = 08900000 120ad780 3190e6bc e0fa5302
c2406000 429204333 C Co:1:032:0 0 16 >
c2406000 429207157 S Co:1:032:0 s 40 a0 04ab 0000 0010 16 = 7e90e6bc e0fbc374 809be433 fb4a9016
c2406000 429207333 C Co:1:032:0 0 16 >
c2406000 429210167 S Co:1:032:0 s 40 a0 04bb 0000 0010 16 = d593fa33 95e0fb74 a12afa74 e63bfb74
c2406000 429210211 C Co:1:032:0 0 16 >
c2406200 429213175 S Co:1:032:0 s 40 a0 04cb 0000 0010 16 = 015af582 75830012 0ad790e6 a0e0fa44
c2406200 429213211 C Co:1:032:0 0 16 >
c2406200 429216932 S Co:1:032:0 s 40 a0 04db 0000 0003 3 = 80f022
c2406200 429217090 C Co:1:032:0 0 3 >
c2406000 429221176 S Co:1:032:0 s 40 a0 16d5 0000 000a 10 = 00010202 03030404 0505
c2406000 429221349 C Co:1:032:0 0 10 >
c2406000 429224019 S Co:1:032:0 s 40 a0 04de 0000 0010 16 = c0e0c0f0 c082c083 c002c003 c004c005
c2406000 429224086 C Co:1:032:0 0 16 >
c2406000 429234933 S Co:1:032:0 s 40 a0 04ee 0000 0010 16 = c006c007 c000c001 c0d075d0 00120dae
c2406000 429235340 C Co:1:032:0 0 16 >
c2406000 429237424 S Co:1:032:0 s 40 a0 04fe 0000 0010 16 = 9203a203 92072003 0890e6a0 e0fa4480
c2406000 429237461 C Co:1:032:0 0 16 >
c2406000 429240366 S Co:1:032:0 s 40 a0 050e 0000 0010 16 = f05391ef 90e65d74 01f0d0d0 d001d000
c2406000 429240458 C Co:1:032:0 0 16 >
c2406000 429243395 S Co:1:032:0 s 40 a0 051e 0000 0010 16 = d007d006 d005d004 d003d002 d083d082
c2406000 429243461 C Co:1:032:0 0 16 >
c2406100 429251060 S Co:1:032:0 s 40 a0 052e 0000 0010 16 = d0f0d0e0 32c0e0c0 82c08353 91ef90e6
c2406100 429252344 C Co:1:032:0 0 16 >
c2406100 429256535 S Co:1:032:0 s 40 a0 053e 0000 0010 16 = 5d7402f0 d083d082 d0e032c0 e0c082c0
c2406100 429257210 C Co:1:032:0 0 16 >
c2406100 429261887 S Co:1:032:0 s 40 a0 054e 0000 0010 16 = 835391ef 90e65d74 04f0d083 d082d0e0
c2406100 429262834 C Co:1:032:0 0 16 >
c2406100 429270299 S Co:1:032:0 s 40 a0 055e 0000 0010 16 = 32c0e0c0 82c08353 91ef90e6 5d7408f0
c2406100 429271340 C Co:1:032:0 0 16 >
c2406100 429274163 S Co:1:032:0 s 40 a0 056e 0000 0010 16 = d083d082 d0e032c0 e0c082c0 835391ef
c2406100 429274210 C Co:1:032:0 0 16 >
c2406100 429276990 S Co:1:032:0 s 40 a0 057e 0000 0010 16 = 90e65d74 10f0d083 d082d0e0 32c0e0c0
c2406100 429277713 C Co:1:032:0 0 16 >
c2406100 429280177 S Co:1:032:0 s 40 a0 058e 0000 0010 16 = 82c08353 91ef90e6 5d7420f0 d083d082
c2406100 429280340 C Co:1:032:0 0 16 >
c2406100 429284991 S Co:1:032:0 s 40 a0 059e 0000 0010 16 = d0e032c0 e0c082c0 835391ef 90e65d74
c2406100 429285217 C Co:1:032:0 0 16 >
c2406100 429293174 S Co:1:032:0 s 40 a0 05ae 0000 0010 16 = 40f0d083 d082d0e0 32c0e0c0 82c08353
c2406100 429294335 C Co:1:032:0 0 16 >
c2406c00 429297712 S Co:1:032:0 s 40 a0 05be 0000 0010 16 = 91ef90e6 5d7480f0 d083d082 d0e032c0
c2406c00 429299087 C Co:1:032:0 0 16 >
c2406700 429306818 S Co:1:032:0 s 40 a0 05ce 0000 0010 16 = e0c082c0 835391ef 90e65f74 01f0d083
c2406700 429307335 C Co:1:032:0 0 16 >
c2406700 429311279 S Co:1:032:0 s 40 a0 05de 0000 0010 16 = d082d0e0 32c0e0c0 82c08353 91ef90e6
c2406700 429311338 C Co:1:032:0 0 16 >
c2406300 429315004 S Co:1:032:0 s 40 a0 05ee 0000 0010 16 = 5f7402f0 d083d082 d0e032c0 e0c082c0
c2406300 429315711 C Co:1:032:0 0 16 >
c2406300 429319776 S Co:1:032:0 s 40 a0 05fe 0000 0010 16 = 835391ef 90e65f74 04f0d083 d082d0e0
c2406300 429320587 C Co:1:032:0 0 16 >
c2406300 429322797 S Co:1:032:0 s 40 a0 060e 0000 0010 16 = 32c0e0c0 82c083d2 0890e68d e4f05391
c2406300 429323591 C Co:1:032:0 0 16 >
c2406300 429327141 S Co:1:032:0 s 40 a0 061e 0000 0010 16 = ef90e65f 7408f0d0 83d082d0 e032c281
c2406300 429327961 C Co:1:032:0 0 16 >
c2406300 429335179 S Co:1:032:0 s 40 a0 062e 0000 0010 16 = 90e6f574 fff00000 0090e6c0 7455f000
c2406300 429336339 C Co:1:032:0 0 16 >
c2406580 429340221 S Co:1:032:0 s 40 a0 063e 0000 0010 16 = 000090e6 047480f0 00000090 e6047402
c2406580 429341087 C Co:1:032:0 0 16 >
c2406580 429344674 S Co:1:032:0 s 40 a0 064e 0000 0010 16 = f0000000 90e604e4 f0000000 90e618e4
c2406580 429345460 C Co:1:032:0 0 16 >
c2406300 429347695 S Co:1:032:0 s 40 a0 065e 0000 0010 16 = f0000000 90e6cee4 f0000000 90e038e0
c2406300 429348460 C Co:1:032:0 0 16 >
c2406300 429357202 S Co:1:032:0 s 40 a0 066e 0000 0010 16 = fa90e6cf f0000000 90e037e0 fa90e6d0
c2406300 429358335 C Co:1:032:0 0 16 >
c2406300 429361651 S Co:1:032:0 s 40 a0 067e 0000 0010 16 = f0000000 90e036e0 fa90e6d1 f0000000
c2406300 429361709 C Co:1:032:0 0 16 >
c2406300 429364675 S Co:1:032:0 s 40 a0 068e 0000 0010 16 = 75bb0490 e032e4f0 a3f0a3f0 a3f022e5
c2406300 429364708 C Co:1:032:0 0 16 >
c2406300 429367718 S Co:1:032:0 s 40 a0 069e 0000 0010 16 = bb30e7fb 90e64874 52f090e6 18740cf0
c2406300 429368460 C Co:1:032:0 0 16 >
c2406300 429370643 S Co:1:032:0 s 40 a0 06ae 0000 0010 16 = 000000d2 8190e604 7480f000 000090e6
c2406300 429371334 C Co:1:032:0 0 16 >
c2406300 429377926 S Co:1:032:0 s 40 a0 06be 0000 0010 16 = 047402f0 00000090 e604e4f0 00000022
c2406300 429379336 C Co:1:032:0 0 16 >
c2406300 429382380 S Co:1:032:0 s 40 a0 06ce 0000 0010 16 = 90e6f574 fff00000 0090e6c0 7455f000
c2406300 429383335 C Co:1:032:0 0 16 >
c2406300 429385396 S Co:1:032:0 s 40 a0 06de 0000 0010 16 = 000090e6 047480f0 00000090 e6047402
c2406300 429386335 C Co:1:032:0 0 16 >
c2406300 429388341 S Co:1:032:0 s 40 a0 06ee 0000 0010 16 = f0000000 90e604e4 f0000000 90e618e4
c2406300 429389087 C Co:1:032:0 0 16 >
c2406300 429391363 S Co:1:032:0 s 40 a0 06fe 0000 0010 16 = f0000000 90e6cee4 f0000000 90e6cfe4
c2406300 429392086 C Co:1:032:0 0 16 >
c2406300 429394382 S Co:1:032:0 s 40 a0 070e 0000 0010 16 = f0000000 90e01fe0 fa90e6d0 f0000000
c2406300 429395210 C Co:1:032:0 0 16 >
c2406300 429398227 S Co:1:032:0 s 40 a0 071e 0000 0010 16 = 90e01ee0 fa90e6d1 f0000000 75bb0400
c2406300 429399087 C Co:1:032:0 0 16 >
c2406300 429408475 S Co:1:032:0 s 40 a0 072e 0000 0010 16 = 0000e5bb 30e7fb90 e6487452 f090e618
c2406300 429409334 C Co:1:032:0 0 16 >
c2406300 429413179 S Co:1:032:0 s 40 a0 073e 0000 0010 16 = 740cf000 000090e6 047480f0 00000090
c2406300 429413335 C Co:1:032:0 0 16 >
c2406300 429418041 S Co:1:032:0 s 40 a0 074e 0000 0010 16 = e6047402 f0000000 90e604e4 f0000000
c2406300 429418084 C Co:1:032:0 0 16 >
c2406300 429421258 S Co:1:032:0 s 40 a0 075e 0000 0010 16 = 22c28130 0b0890e6 18740df0 800690e6
c2406300 429421336 C Co:1:032:0 0 16 >
c2406300 429424523 S Co:1:032:0 s 40 a0 076e 0000 0010 16 = 18740cf0 90e6f574 fff00000 0090e6c0
c2406300 429424959 C Co:1:032:0 0 16 >
c2406300 429427356 S Co:1:032:0 s 40 a0 077e 0000 0010 16 = e4f00000 0090e604 7480f000 000090e6
c2406300 429427459 C Co:1:032:0 0 16 >
c2406300 429432106 S Co:1:032:0 s 40 a0 078e 0000 0010 16 = 047402f0 00000090 e604e4f0 00000090
c2406300 429432335 C Co:1:032:0 0 16 >
c2406300 429437164 S Co:1:032:0 s 40 a0 079e 0000 0010 16 = e6cee4f0 00000090 e038e0fa 90e6cff0
c2406300 429437460 C Co:1:032:0 0 16 >
c2406300 429440666 S Co:1:032:0 s 40 a0 07ae 0000 0010 16 = 00000090 e037e0fa 90e6d0f0 00000090
c2406300 429441340 C Co:1:032:0 0 16 >
c2406c00 429445564 S Co:1:032:0 s 40 a0 07be 0000 0010 16 = e036e0fa 90e6d1f0 000000c2 8c90e032
c2406c00 429452336 C Co:1:032:0 0 16 >
c2406c00 429457151 S Co:1:032:0 s 40 a0 07ce 0000 0010 16 = e4f0a3f0 a3f0a3f0 d28c90e6 cfe0fa70
c2406c00 429466336 C Co:1:032:0 0 16 >
c2406c00 429469677 S Co:1:032:0 s 40 a0 07de 0000 0010 16 = 0e90e6d0 e0fa7007 90e6d1e0 fa600d75
c2406c00 429470463 C Co:1:032:0 0 16 >
c2406c00 429479699 S Co:1:032:0 s 40 a0 07ee 0000 0010 16 = bb040000 00e5bb20 e7e080f9 90e64874
c2406c00 429480335 C Co:1:032:0 0 16 >
c2406c00 429482724 S Co:1:032:0 s 40 a0 07fe 0000 0010 16 = 02f0d281 2290e600 e0fa74e7 5a90e600
c2406c00 429482835 C Co:1:032:0 0 16 >
c2406c00 429487760 S Co:1:032:0 s 40 a0 080e 0000 0010 16 = 4410f000 000090e6 0b7401f0 00000090
c2406c00 429489335 C Co:1:032:0 0 16 >
c2406c00 429492740 S Co:1:032:0 s 40 a0 081e 0000 0010 16 = e61274e0 f0000000 90e613e4 f0000000
c2406c00 429493714 C Co:1:032:0 0 16 >
c2406c00 429500763 S Co:1:032:0 s 40 a0 082e 0000 0010 16 = 90e614e4 f0000000 90e615e4 f0000000
c2406c00 429502335 C Co:1:032:0 0 16 >
c2406c00 429505801 S Co:1:032:0 s 40 a0 083e 0000 0010 16 = 90e61074 a0f00000 0090e6d2 7402f000
c2406c00 429506711 C Co:1:032:0 0 16 >
c2406c00 429510413 S Co:1:032:0 s 40 a0 084e 0000 0010 16 = 000090e6 047480f0 00000090 e6047402
c2406c00 429511211 C Co:1:032:0 0 16 >
c2406c00 429514948 S Co:1:032:0 s 40 a0 085e 0000 0010 16 = f0000000 90e604e4 f0000000 90e68de4
c2406c00 429515085 C Co:1:032:0 0 16 >
c2406c00 429517971 S Co:1:032:0 s 40 a0 086e 0000 0010 16 = f090e601 74caf090 e6f574ff f090e6f3
c2406c00 429519085 C Co:1:032:0 0 16 >
c2406c00 429530188 S Co:1:032:0 s 40 a0 087e 0000 0010 16 = 74a0f090 e6c37410 f090e6c1 e4f090e6
c2406c00 429531339 C Co:1:032:0 0 16 >
c2406c00 429534717 S Co:1:032:0 s 40 a0 088e 0000 0010 16 = c2f090e6 f4f075af 07759de4 759e007a
c2406c00 429534835 C Co:1:032:0 0 16 >
c2406c00 429537741 S Co:1:032:0 s 40 a0 089e 0000 0010 16 = df7b168b 9a7adf7b 167b008a 9b90e002
c2406c00 429537834 C Co:1:032:0 0 16 >
c2406c00 429540693 S Co:1:032:0 s 40 a0 08ae 0000 0010 16 = 7440f090 e002e0fa 1490e002 f0ea600b
c2406c00 429540838 C Co:1:032:0 0 16 >
c2406c00 429543719 S Co:1:032:0 s 40 a0 08be 0000 0010 16 = 90e67be0 fa90e67c f080e890 e6c6e4f0
c2406c00 429543834 C Co:1:032:0 0 16 >
c2406c00 429551694 S Co:1:032:0 s 40 a0 08ce 0000 0010 16 = 90e6c7f0 90e6c8f0 90e6c9f0 90e6cae4
c2406c00 429553338 C Co:1:032:0 0 16 >
c2406c00 429556220 S Co:1:032:0 s 40 a0 08de 0000 0010 16 = f090e6cb f090e6cc f090e6cd f090e680
c2406c00 429556334 C Co:1:032:0 0 16 >
c2406080 429559165 S Co:1:032:0 s 40 a0 08ee 0000 0010 16 = e0fa30e7 0d90009f e4f09000 a07402f0
c2406080 429559209 C Co:1:032:0 0 16 >
c2406080 429562232 S Co:1:032:0 s 40 a0 08fe 0000 0010 16 = 800b9000 9f7440f0 9000a0e4 f090e678
c2406080 429563463 C Co:1:032:0 0 16 >
c2406080 429567229 S Co:1:032:0 s 40 a0 090e 0000 0010 16 = e0fa4480 f090e679 74a0f012 0bd690e6
c2406080 429568461 C Co:1:032:0 0 16 >
c2406080 429573726 S Co:1:032:0 s 40 a0 091e 0000 0010 16 = 797405f0 120bd690 e678e0fa 4440f012
c2406080 429575335 C Co:1:032:0 0 16 >
c2406080 429582400 S Co:1:032:0 s 40 a0 092e 0000 0010 16 = 0bd690e6 78e0fa44 80f090e6 7974a1f0
c2406080 429583337 C Co:1:032:0 0 16 >
c2406080 429586200 S Co:1:032:0 s 40 a0 093e 0000 0010 16 = 120bd690 e678e0fa 4420f090 e679e0fa
c2406080 429586337 C Co:1:032:0 0 16 >
c2406280 429589160 S Co:1:032:0 s 40 a0 094e 0000 0010 16 = 900072f0 120bd690 e678e0fa 4440f012
c2406280 429589959 C Co:1:032:0 0 16 >
c2406280 429592163 S Co:1:032:0 s 40 a0 095e 0000 0010 16 = 0bd690e6 79e090e6 78e0fa44 40f09000
c2406280 429592334 C Co:1:032:0 0 16 >
c2406280 429595127 S Co:1:032:0 s 40 a0 096e 0000 0010 16 = 72e4f090 e678e0fa 4480f090 e67974a0
c2406280 429595210 C Co:1:032:0 0 16 >
c2406280 429598222 S Co:1:032:0 s 40 a0 097e 0000 0010 16 = f0120bd6 90e67974 06f0120b d690e678
c2406280 429598335 C Co:1:032:0 0 16 >
c2406280 429603106 S Co:1:032:0 s 40 a0 098e 0000 0010 16 = e0fa4440 f0120bd6 90e678e0 fa4480f0
c2406280 429605343 C Co:1:032:0 0 16 >
c2406280 429625944 S Co:1:032:0 s 40 a0 099e 0000 0010 16 = 90e67974 a1f0120b d690e678 e0fa4420
c2406280 429627336 C Co:1:032:0 0 16 >
c2406280 429635614 S Co:1:032:0 s 40 a0 09ae 0000 0010 16 = f090e679 e0fa9000 73f0120b d690e678
c2406280 429637342 C Co:1:032:0 0 16 >
c2406280 429640154 S Co:1:032:0 s 40 a0 09be 0000 0010 16 = e0fa4440 f0120bd6 90e679e0 90e678e0
c2406280 429640335 C Co:1:032:0 0 16 >
c2406280 429643156 S Co:1:032:0 s 40 a0 09ce 0000 0010 16 = fa4440f0 900073e4 f09000a0 e0fa90e6
c2406280 429643336 C Co:1:032:0 0 16 >
c2406280 429646109 S Co:1:032:0 s 40 a0 09de 0000 0010 16 = 20f00000 0090009f e0fa90e6 21f00000
c2406280 429646209 C Co:1:032:0 0 16 >
c2406280 429649150 S Co:1:032:0 s 40 a0 09ee 0000 0010 16 = 0090e000 7482f0a3 7400f0d2 0090e671
c2406280 429649208 C Co:1:032:0 0 16 >
c2406280 429652148 S Co:1:032:0 s 40 a0 09fe 0000 0010 16 = e4f075b4 0090e670 e4f075b2 f390e672
c2406280 429652208 C Co:1:032:0 0 16 >
c2406280 429655156 S Co:1:032:0 s 40 a0 0a0e 0000 0010 16 = e4f075b6 00758003 75b50075 b30090e6
c2406280 429655334 C Co:1:032:0 0 16 >
c2406280 429658124 S Co:1:032:0 s 40 a0 0a1e 0000 0010 16 = 00e0fa44 02f090e6 5ee0fa44 08f022c2
c2406280 429658209 C Co:1:032:0 0 16 >
c2406280 429667687 S Co:1:032:0 s 40 a0 0a2e 0000 0010 16 = 0bc20690 e00be4f0 a3f0a3f0 a3f0c209
c2406280 429668334 C Co:1:032:0 0 16 >
c2406280 429670631 S Co:1:032:0 s 40 a0 0a3e 0000 0010 16 = 90e013e4 f0a3f0a3 f0a3f090 e032e4f0
c2406280 429670709 C Co:1:032:0 0 16 >
c2406280 429673654 S Co:1:032:0 s 40 a0 0a4e 0000 0010 16 = a3f0a3f0 a3f0c20a 90e03974 fff0a3f0
c2406280 429673708 C Co:1:032:0 0 16 >
c2406280 429676678 S Co:1:032:0 s 40 a0 0a5e 0000 0010 16 = a374fff0 a3f090e0 3d74fff0 a3f0a374
c2406280 429676834 C Co:1:032:0 0 16 >
c2406280 429683630 S Co:1:032:0 s 40 a0 0a6e 0000 0010 16 = fff0a3f0 12145c12 0a9e90e0 1be4f090
c2406280 429684335 C Co:1:032:0 0 16 >
c2406280 429688158 S Co:1:032:0 s 40 a0 0a7e 0000 000e 14 = e02ef0a3 f0a3f0a3 f0c204c2 0522
c2406280 429688334 C Co:1:032:0 0 14 >
c2406280 429691200 S Co:1:032:0 s 40 a0 16df 0000 0010 16 = 01010101 01010107 02000200 02000200
c2406280 429691338 C Co:1:032:0 0 16 >
c2406b80 429700672 S Co:1:032:0 s 40 a0 16ef 0000 0010 16 = 01000100 01000100 00000000 0000003f
c2406b80 429701337 C Co:1:032:0 0 16 >
c2406000 429705196 S Co:1:032:0 s 40 a0 16ff 0000 0010 16 = 01380101 01010107 00030000 00000000
c2406000 429705345 C Co:1:032:0 0 16 >
c2406000 429708151 S Co:1:032:0 s 40 a0 170f 0000 0010 16 = 00010000 00000000 002d0000 0000003f
c2406000 429708209 C Co:1:032:0 0 16 >
c2406000 429711163 S Co:1:032:0 s 40 a0 031f 0000 000c 12 = c204c205 c208c209 c20ac20b
c2406000 429711336 C Co:1:032:0 0 12 >
c2406000 429714186 S Co:1:032:0 s 40 a0 0a8c 0000 0010 16 = 7aff7bff 8a048b05 1abaff01 1bec4d70
c2406000 429714334 C Co:1:032:0 0 16 >
c2406000 429717209 S Co:1:032:0 s 40 a0 0a9c 0000 0010 16 = f322c280 120a8cd2 8090e032 74fff0a3
c2406000 429717334 C Co:1:032:0 0 16 >
c2406000 429720154 S Co:1:032:0 s 40 a0 0aac 0000 0010 16 = f0a374ff f0a3747f f090e01d 7401f002
c2406000 429720209 C Co:1:032:0 0 16 >
c2406000 429728799 S Co:1:032:0 s 40 a0 0abc 0000 0002 2 = 0b56
c2406000 429729337 C Co:1:032:0 0 2 >
c2406180 429736183 S Co:1:032:0 s 40 a0 171f 0000 0010 16 = 00000000 00000000 00000000 00000000
c2406180 429736335 C Co:1:032:0 0 16 >
c2406180 429739123 S Co:1:032:0 s 40 a0 172f 0000 000b 11 = 186ac8ff ffffffff ffffff
c2406180 429739211 C Co:1:032:0 0 11 >
c2406180 429742168 S Co:1:032:0 s 40 a0 0000 0000 0010 16 = 02033302 dead0000 00000002 14740000
c2406180 429742210 C Co:1:032:0 0 16 >
c2406180 429745216 S Co:1:032:0 s 40 a0 0010 0000 0010 16 = 00000002 dead0000 00000002 dead0000
c2406180 429745336 C Co:1:032:0 0 16 >
c2406180 429748163 S Co:1:032:0 s 40 a0 0020 0000 0010 16 = 00000002 dead0000 00000002 dead0000
c2406180 429748212 C Co:1:032:0 0 16 >
c2406180 429751169 S Co:1:032:0 s 40 a0 0030 0000 0010 16 = 00000002 dead0000 00000002 dead0000
c2406180 429751213 C Co:1:032:0 0 16 >
c2406180 429754165 S Co:1:032:0 s 40 a0 0040 0000 0010 16 = 00000002 01000000 00000002 dead0000
c2406180 429754209 C Co:1:032:0 0 16 >
c2406180 429757190 S Co:1:032:0 s 40 a0 0050 0000 0010 16 = 00000002 01000000 00000002 dead0000
c2406180 429757336 C Co:1:032:0 0 16 >
c2406180 429760161 S Co:1:032:0 s 40 a0 0060 0000 0006 6 = 00000002 dead
c2406180 429760212 C Co:1:032:0 0 6 >
c2406200 429763175 S Co:1:032:0 s 40 a0 0100 0000 0010 16 = 0204de00 02053300 02054900 02055f00
c2406200 429763210 C Co:1:032:0 0 16 >
c2406500 429766184 S Co:1:032:0 s 40 a0 0110 0000 0010 16 = 02057500 02058b00 0205a100 0205b700
c2406500 429766336 C Co:1:032:0 0 16 >
c2406500 429769162 S Co:1:032:0 s 40 a0 0120 0000 0010 16 = 0205cd00 0205e300 0205f900 02060f00
c2406500 429769210 C Co:1:032:0 0 16 >
c2406b80 429774104 S Co:1:032:0 s 40 a0 0130 0000 0010 16 = 02dead00 02dead00 02dead00 02dead00
c2406b80 429774216 C Co:1:032:0 0 16 >
c2406280 429776594 S Co:1:032:0 s 40 a0 0140 0000 0010 16 = 02dead00 02dead00 02dead00 02dead00
c2406280 429776712 C Co:1:032:0 0 16 >
c2406500 429779924 S Co:1:032:0 s 40 a0 0150 0000 0010 16 = 02dead00 02dead00 02dead00 02dead00
c2406500 429780085 C Co:1:032:0 0 16 >
c2406580 429782567 S Co:1:032:0 s 40 a0 0160 0000 0010 16 = 02dead00 02dead00 02dead00 02dead00
c2406580 429782710 C Co:1:032:0 0 16 >
c2406300 429785587 S Co:1:032:0 s 40 a0 0170 0000 0010 16 = 02dead00 02dead00 02dead00 02dead00
c2406300 429785710 C Co:1:032:0 0 16 >
c2406300 429791649 S Co:1:032:0 s 40 a0 0180 0000 0010 16 = 02dead00 02dead00 02dead00 02dead00
c2406300 429792336 C Co:1:032:0 0 16 >
c2406300 429794676 S Co:1:032:0 s 40 a0 0190 0000 0010 16 = 02dead00 02dead00 02dead00 02dead00
c2406300 429794835 C Co:1:032:0 0 16 >
c2406a80 429800769 S Co:1:032:0 s 40 a0 01a0 0000 0010 16 = 02dead00 02dead00 02dead00 02dead00
c2406a80 429801335 C Co:1:032:0 0 16 >
c2406a80 429803789 S Co:1:032:0 s 40 a0 01b0 0000 0008 8 = 02dead00 02dead00
c2406a80 429803834 C Co:1:032:0 0 8 >
c2406080 429810090 S Co:1:032:0 s 40 a0 0abe 0000 0010 16 = 12062c02 069daa82 90e740ea f090e68a
c2406080 429810338 C Co:1:032:0 0 16 >
c2406180 429812594 S Co:1:032:0 s 40 a0 0ace 0000 0010 16 = e4f090e6 8b7401f0 22aa82ab 838a047d
c2406180 429812712 C Co:1:032:0 0 16 >
c2406c00 429815620 S Co:1:032:0 s 40 a0 0ade 0000 0010 16 = 0090e740 ecf08b02 7b0090e7 41eaf090
c2406c00 429815710 C Co:1:032:0 0 16 >
c2406500 429824184 S Co:1:032:0 s 40 a0 0aee 0000 0010 16 = e68ae4f0 90e68b74 02f022aa 82ab83ac
c2406500 429825338 C Co:1:032:0 0 16 >
c2406080 429829169 S Co:1:032:0 s 40 a0 0afe 0000 0010 16 = f0fd8a06 7f007800 790090e7 40eef08b
c2406080 429829211 C Co:1:032:0 0 16 >
c2406080 429832170 S Co:1:032:0 s 40 a0 0b0e 0000 0010 16 = 028c038d 047d008a 067f0078 00790090
c2406080 429832210 C Co:1:032:0 0 16 >
c2406080 429835246 S Co:1:032:0 s 40 a0 0b1e 0000 0010 16 = e741eef0 8b028c03 8d047d00 8a067f00
c2406080 429835335 C Co:1:032:0 0 16 >
c2406080 429838162 S Co:1:032:0 s 40 a0 0b2e 0000 0010 16 = 78007900 90e742ee f08b028c 038d047d
c2406080 429838210 C Co:1:032:0 0 16 >
c2406080 429841163 S Co:1:032:0 s 40 a0 0b3e 0000 0010 16 = 007b007c 007d0090 e743eaf0 90e68ae4
c2406080 429841214 C Co:1:032:0 0 16 >
c2406080 429844183 S Co:1:032:0 s 40 a0 0b4e 0000 0010 16 = f090e68b 7404f022 90e01de0 fa701c90
c2406080 429844335 C Co:1:032:0 0 16 >
c2406080 429847208 S Co:1:032:0 s 40 a0 0b5e 0000 0010 16 = e022e0fa a3e0fba3 e0fca3e0 fd90e017
c2406080 429847335 C Co:1:032:0 0 16 >
c2406080 429850164 S Co:1:032:0 s 40 a0 0b6e 0000 0010 16 = eaf0a3eb f0a3ecf0 a3edf090 e01de0fa
c2406080 429850210 C Co:1:032:0 0 16 >
c2406080 429853181 S Co:1:032:0 s 40 a0 0b7e 0000 0010 16 = ba011190 e01774c8 f0a3746a f0a37418
c2406080 429853335 C Co:1:032:0 0 16 >
c2406080 429856204 S Co:1:032:0 s 40 a0 0b8e 0000 0010 16 = f0a3e4f0 90e017e0 faa3e0fb a3e0fca3
c2406080 429856336 C Co:1:032:0 0 16 >
c2406080 429859146 S Co:1:032:0 s 40 a0 0b9e 0000 0010 16 = e0fd8a06 7f007800 790090e0 36eef08b
c2406080 429859211 C Co:1:032:0 0 16 >
c2406080 429862169 S Co:1:032:0 s 40 a0 0bae 0000 0010 16 = 028c038d 047d008a 067f0078 00790090
c2406080 429862210 C Co:1:032:0 0 16 >
c2406080 429865193 S Co:1:032:0 s 40 a0 0bbe 0000 0010 16 = e037eef0 8b028c03 8d047d00 7b007c00
c2406080 429865335 C Co:1:032:0 0 16 >
c2406080 429868174 S Co:1:032:0 s 40 a0 0bce 0000 0010 16 = 7d0090e0 38eaf022 7a647b00 8a048b05
c2406080 429868335 C Co:1:032:0 0 16 >
c2406300 429871585 S Co:1:032:0 s 40 a0 0bde 0000 0010 16 = 1abaff01 1bec4d70 f322120a 9e90e01d
c2406300 429871712 C Co:1:032:0 0 16 >
c2406300 429874188 S Co:1:032:0 s 40 a0 0bee 0000 0010 16 = 7401f012 0b567a40 7be78b9a 7a407be7
c2406300 429874335 C Co:1:032:0 0 16 >
c2406300 429877211 S Co:1:032:0 s 40 a0 0bfe 0000 0010 16 = 7b008a9b 12062c90 e678e0fa 4480f090
c2406300 429877336 C Co:1:032:0 0 16 >
c2406400 429880176 S Co:1:032:0 s 40 a0 0c0e 0000 0010 16 = e67974ba f0120bd6 90e67974 2bf0120b
c2406400 429880334 C Co:1:032:0 0 16 >
c2406400 429883178 S Co:1:032:0 s 40 a0 0c1e 0000 0010 16 = d690e67b e0fa90e6 79f0120b d690e67b
c2406400 429883336 C Co:1:032:0 0 16 >
c2406100 429888197 S Co:1:032:0 s 40 a0 0c2e 0000 0010 16 = e0fa90e6 79f0120b d690e67b e0fa90e6
c2406100 429888342 C Co:1:032:0 0 16 >
c2406b80 429891175 S Co:1:032:0 s 40 a0 0c3e 0000 0010 16 = 79f0120b d690e67b e0fa90e6 79f0120b
c2406b80 429891334 C Co:1:032:0 0 16 >
c2406380 429896194 S Co:1:032:0 s 40 a0 0c4e 0000 0010 16 = d690e67b e0fa90e6 79f0120b d690e67b
c2406380 429896335 C Co:1:032:0 0 16 >
c2406380 429899167 S Co:1:032:0 s 40 a0 0c5e 0000 0010 16 = e0fa90e6 79f0120b d690e67b e0fa90e6
c2406380 429899211 C Co:1:032:0 0 16 >
c2406380 429902167 S Co:1:032:0 s 40 a0 0c6e 0000 0010 16 = 79f0120b d690e67b e0fa90e6 79f0120b
c2406380 429902212 C Co:1:032:0 0 16 >
c2406b80 429905193 S Co:1:032:0 s 40 a0 0c7e 0000 0010 16 = d690e678 e0fa4440 f0120bd6 90e678e0
c2406b80 429905335 C Co:1:032:0 0 16 >
c2406300 429908806 S Co:1:032:0 s 40 a0 0c8e 0000 0010 16 = fa4480f0 90e67974 baf0120b d690e679
c2406300 429908962 C Co:1:032:0 0 16 >
c2406300 429911178 S Co:1:032:0 s 40 a0 0c9e 0000 0010 16 = 7401f012 0bd690e6 7be0fa90 e679f012
c2406300 429911337 C Co:1:032:0 0 16 >
f1c73e80 429914195 S Co:1:032:0 s 40 a0 0cae 0000 0010 16 = 0bd690e6 7be0fa90 e679f012 0bd690e6
f1c73e80 429914340 C Co:1:032:0 0 16 >
f1c73780 429919170 S Co:1:032:0 s 40 a0 0cbe 0000 0010 16 = 7be0fa90 e679f012 0bd690e6 7be0fa90
f1c73780 429919836 C Co:1:032:0 0 16 >
f1c73c80 429922169 S Co:1:032:0 s 40 a0 0cce 0000 0010 16 = e679f012 0bd690e6 7be0fa90 e679f012
f1c73c80 429922334 C Co:1:032:0 0 16 >
f1c73c80 429925195 S Co:1:032:0 s 40 a0 0cde 0000 0010 16 = 0bd690e6 7be0fa90 e679f012 0bd690e6
f1c73c80 429925336 C Co:1:032:0 0 16 >
f1c73c80 429929559 S Co:1:032:0 s 40 a0 0cee 0000 0010 16 = 7be0fa90 e679f012 0bd690e6 7be0fa90
f1c73c80 429929709 C Co:1:032:0 0 16 >
f1c73080 429934091 S Co:1:032:0 s 40 a0 0cfe 0000 0010 16 = e679f012 0bd690e6 78e0fa44 40f0120b
f1c73080 429934335 C Co:1:032:0 0 16 >
f1c73e80 429937121 S Co:1:032:0 s 40 a0 0d0e 0000 0010 16 = d690e678 e0fa4480 f090e679 74baf012
f1c73e80 429937210 C Co:1:032:0 0 16 >
f1c73100 429940356 S Co:1:032:0 s 40 a0 0d1e 0000 0010 16 = 0bd690e6 797409f0 120bd690 e67be0fa
f1c73100 429940459 C Co:1:032:0 0 16 >
f1c73100 429943091 S Co:1:032:0 s 40 a0 0d2e 0000 0010 16 = 90e679f0 120bd690 e67be0fa 90e679f0
f1c73100 429943210 C Co:1:032:0 0 16 >
f1c73580 429955243 S Co:1:032:0 s 40 a0 0d3e 0000 0010 16 = 120bd690 e678e0fa 4440f090 e678e0fa
f1c73580 429956339 C Co:1:032:0 0 16 >
f1c73800 429959680 S Co:1:032:0 s 40 a0 0d4e 0000 0010 16 = 4480f090 e67974ba f0120bd6 90e67974
f1c73800 429959834 C Co:1:032:0 0 16 >
f1c73a00 429962709 S Co:1:032:0 s 40 a0 0d5e 0000 0010 16 = 62f0120b d690e679 741cf012 0bd690e6
f1c73a00 429962835 C Co:1:032:0 0 16 >
f1c73a00 429965726 S Co:1:032:0 s 40 a0 0d6e 0000 0010 16 = 79749ef0 120bd690 e678e0fa 4440f012
f1c73a00 429965836 C Co:1:032:0 0 16 >
f1c73c80 429973840 S Co:1:032:0 s 40 a0 0d7e 0000 0010 16 = 069d90e0 1de4f012 0b56120a be90e032
f1c73c80 429974336 C Co:1:032:0 0 16 >
f1c73080 429976833 S Co:1:032:0 s 40 a0 0d8e 0000 0010 16 = e0faa3e0 fba3e0fc a3e0fd90 e01beaf0
f1c73080 429976959 C Co:1:032:0 0 16 >
f1c73200 429981768 S Co:1:032:0 s 40 a0 0d9e 0000 0010 16 = e02401f0 22300a07 12075fc2 0ac20922
f1c73200 429981961 C Co:1:032:0 0 16 >
f1c73a80 429987337 S Co:1:032:0 s 40 a0 0dae 0000 0010 16 = 90e6b9e0 faba1003 0213a3ba 11030210
f1c73a80 429988336 C Co:1:032:0 0 16 >
f1c73980 429992287 S Co:1:032:0 s 40 a0 0dbe 0000 0010 16 = 30ba1203 0211ebba 13030210 39ba1403
f1c73980 429992469 C Co:1:032:0 0 16 >
f1c73d80 429999508 S Co:1:032:0 s 40 a0 0dce 0000 0010 16 = 021078ba 15030211 23ba1703 0210f1ba
f1c73d80 430005337 C Co:1:032:0 0 16 >
f1c73d00 430016348 S Co:1:032:0 s 40 a0 0dde 0000 0010 16 = 18030213 07ba1903 0212daba 20030210
f1c73d00 430017337 C Co:1:032:0 0 16 >
f1c73d00 430020793 S Co:1:032:0 s 40 a0 0dee 0000 0010 16 = 9aba2103 021335ba 22030213 6cba2503
f1c73d00 430020834 C Co:1:032:0 0 16 >
f1c73d00 430023816 S Co:1:032:0 s 40 a0 0dfe 0000 0010 16 = 020ff3ba 2603020f 7cba2703 0210d8ba
f1c73d00 430023960 C Co:1:032:0 0 16 >
f1c73d00 430026838 S Co:1:032:0 s 40 a0 0e0e 0000 0010 16 = 5502800f ba660302 110dba68 03021118
f1c73d00 430026961 C Co:1:032:0 0 16 >
f1c73d00 430036709 S Co:1:032:0 s 40 a0 0e1e 0000 0010 16 = 02145390 e6bce0fa 603cba01 028051ba
f1c73d00 430037343 C Co:1:032:0 0 16 >
f1c73d00 430039655 S Co:1:032:0 s 40 a0 0e2e 0000 0010 16 = 02028066 ba030280 7bba0403 020eccba
f1c73d00 430039709 C Co:1:032:0 0 16 >
f1c73d00 430042677 S Co:1:032:0 s 40 a0 0e3e 0000 0010 16 = 0503020e e4ba0603 020efcba 0703020f
f1c73d00 430042835 C Co:1:032:0 0 16 >
f1c73d00 430045696 S Co:1:032:0 s 40 a0 0e4e 0000 0010 16 = 16ba0803 020f30ba 0903020f 48ba6303
f1c73d00 430045834 C Co:1:032:0 0 16 >
f1c73d00 430055187 S Co:1:032:0 s 40 a0 0e5e 0000 0010 16 = 020f6102 0f6f90e0 17e0faa3 e0fba3e0
f1c73d00 430056343 C Co:1:032:0 0 16 >
f1c73d00 430059630 S Co:1:032:0 s 40 a0 0e6e 0000 0010 16 = fca3e0fd 8a828b83 8cf0120a f9021458
f1c73d00 430059711 C Co:1:032:0 0 16 >
f1c73d00 430063702 S Co:1:032:0 s 40 a0 0e7e 0000 0010 16 = 90e032e0 faa3e0fb a3e0fca3 e0fd8a82
f1c73d00 430063835 C Co:1:032:0 0 16 >
f1c73d00 430066219 S Co:1:032:0 s 40 a0 0e8e 0000 0010 16 = 8b838cf0 120af902 145890e0 0be0faa3
f1c73d00 430066335 C Co:1:032:0 0 16 >
f1c73e00 430076168 S Co:1:032:0 s 40 a0 0e9e 0000 0010 16 = e0fba3e0 fca3e0fd 8a828b83 8cf0120a
f1c73e00 430077337 C Co:1:032:0 0 16 >
f1c73e00 430082712 S Co:1:032:0 s 40 a0 0eae 0000 0010 16 = f9021458 90e013e0 faa3e0fb a3e0fca3
f1c73e00 430082836 C Co:1:032:0 0 16 >
f1c73e00 430086186 S Co:1:032:0 s 40 a0 0ebe 0000 0010 16 = e0fd8a82 8b838cf0 120af902 1458e4a2
f1c73e00 430086335 C Co:1:032:0 0 16 >
f1c73e80 430090614 S Co:1:032:0 s 40 a0 0ece 0000 0010 16 = 0933fa7b 007c007d 008a828b 838cf0ed
f1c73e80 430090710 C Co:1:032:0 0 16 >
f1c73580 430094486 S Co:1:032:0 s 40 a0 0ede 0000 0010 16 = 120af902 1458e4a2 0a33fa7b 007c007d
f1c73580 430094584 C Co:1:032:0 0 16 >
f1c73580 430097004 S Co:1:032:0 s 40 a0 0eee 0000 0010 16 = 008a828b 838cf0ed 120af902 145890e0
f1c73580 430102335 C Co:1:032:0 0 16 >
f1c73480 430105758 S Co:1:032:0 s 40 a0 0efe 0000 0010 16 = 03e0faa3 e0fba3e0 fca3e0fd 8a828b83
f1c73480 430105962 C Co:1:032:0 0 16 >
f1c73c80 430112235 S Co:1:032:0 s 40 a0 0f0e 0000 0010 16 = 8cf0120a f9021458 90e007e0 faa3e0fb
f1c73c80 430113335 C Co:1:032:0 0 16 >
f1c73200 430116871 S Co:1:032:0 s 40 a0 0f1e 0000 0010 16 = a3e0fca3 e0fd8a82 8b838cf0 120af902
f1c73200 430117086 C Co:1:032:0 0 16 >
f1c73200 430121722 S Co:1:032:0 s 40 a0 0f2e 0000 0010 16 = 145890e0 1be0fa7b 007c007d 008a828b
f1c73200 430121835 C Co:1:032:0 0 16 >
f1c73b80 430124749 S Co:1:032:0 s 40 a0 0f3e 0000 0010 16 = 838cf0ed 120af902 145890e0 1ee0faa3
f1c73b80 430124839 C Co:1:032:0 0 16 >
f1c73c00 430130481 S Co:1:032:0 s 40 a0 0f4e 0000 0010 16 = e0fb7c00 7d008a82 8b838cf0 ed120af9
f1c73c00 430131335 C Co:1:032:0 0 16 >
f1c73980 430133503 S Co:1:032:0 s 40 a0 0f5e 0000 0010 16 = 02145890 0009e4f5 f0741012 0af90214
f1c73980 430133585 C Co:1:032:0 0 16 >
f1c73c80 430140856 S Co:1:032:0 s 40 a0 0f6e 0000 0010 16 = 5890ffff 74fff5f0 120af902 145890e6
f1c73c80 430141334 C Co:1:032:0 0 16 >
f1c73680 430143880 S Co:1:032:0 s 40 a0 0f7e 0000 0010 16 = 78e0fa44 80f090e6 7974a0f0 120bd690
f1c73680 430143961 C Co:1:032:0 0 16 >
f1c73680 430153165 S Co:1:032:0 s 40 a0 0f8e 0000 0010 16 = e6bce0fa 90e679f0 120bd690 e678e0fa
f1c73680 430153335 C Co:1:032:0 0 16 >
f1c73680 430156160 S Co:1:032:0 s 40 a0 0f9e 0000 0010 16 = 4440f012 0bd690e6 78e0fa44 80f090e6
f1c73680 430156209 C Co:1:032:0 0 16 >
f1c73680 430159167 S Co:1:032:0 s 40 a0 0fae 0000 0010 16 = 7974a1f0 120bd690 e678e0fa 4420f090
f1c73680 430159210 C Co:1:032:0 0 16 >
f1c73680 430161945 S Co:1:032:0 s 40 a0 0fbe 0000 0010 16 = e679e0fa 90e021f0 120bd690 e678e0fa
f1c73680 430162085 C Co:1:032:0 0 16 >
f1c73900 430164970 S Co:1:032:0 s 40 a0 0fce 0000 0010 16 = 4440f012 0bd690e6 79e0fa90 e740f090
f1c73900 430165085 C Co:1:032:0 0 16 >
f1c73080 430168165 S Co:1:032:0 s 40 a0 0fde 0000 0010 16 = e68ae4f0 90e68b74 01f090e6 78e0fa44
f1c73080 430168211 C Co:1:032:0 0 16 >
f1c73b80 430171165 S Co:1:032:0 s 40 a0 0fee 0000 0010 16 = 40f00214 5890e678 e0fa4480 f090e679
f1c73b80 430171210 C Co:1:032:0 0 16 >
f1c73f80 430174301 S Co:1:032:0 s 40 a0 0ffe 0000 0010 16 = 74a0f012 0bd690e6 bce0fa90 e679f012
f1c73f80 430174334 C Co:1:032:0 0 16 >
f1c73d00 430176987 S Co:1:032:0 s 40 a0 100e 0000 0010 16 = 0bd690e6 bae0fa90 e679f012 0bd690e6
f1c73d00 430177085 C Co:1:032:0 0 16 >
f1c73980 430189259 S Co:1:032:0 s 40 a0 101e 0000 0010 16 = 78e0fa44 40f090e6 8ae4f090 e68bf002
f1c73980 430190336 C Co:1:032:0 0 16 >
f1c73b80 430194607 S Co:1:032:0 s 40 a0 102e 0000 0010 16 = 145890de ad120ad7 02145820 093090e6
f1c73b80 430194710 C Co:1:032:0 0 16 >
f1c73980 430196807 S Co:1:032:0 s 40 a0 103e 0000 0010 16 = bae0faa3 e0fba3e0 fca3e0fd 90e022ea
f1c73980 430196960 C Co:1:032:0 0 16 >
f1c73980 430202714 S Co:1:032:0 s 40 a0 104e 0000 0010 16 = f0a3ebf0 a3ecf0a3 edf090e6 8ae4f090
f1c73980 430203335 C Co:1:032:0 0 16 >
f1c73580 430207388 S Co:1:032:0 s 40 a0 105e 0000 0010 16 = e68bf090 e6a0e0fa 20e1f812 0be890e6
f1c73580 430207479 C Co:1:032:0 0 16 >
f1c73480 430210332 S Co:1:032:0 s 40 a0 106e 0000 0010 16 = 8ae4f090 e68bf002 14582009 1390e6ba
f1c73480 430210459 C Co:1:032:0 0 16 >
f1c73700 430215372 S Co:1:032:0 s 40 a0 107e 0000 0010 16 = e0faa3e0 fb90e01e eaf0a3eb f01206ce
f1c73700 430215587 C Co:1:032:0 0 16 >
f1c73580 430225152 S Co:1:032:0 s 40 a0 108e 0000 0010 16 = 90e68ae4 f090e68b f0021458 90e6f574
f1c73580 430225341 C Co:1:032:0 0 16 >
f1c73580 430227660 S Co:1:032:0 s 40 a0 109e 0000 0010 16 = fff00000 0090e648 7482f090 e6047480
f1c73580 430227710 C Co:1:032:0 0 16 >
f1c73580 430230604 S Co:1:032:0 s 40 a0 10ae 0000 0010 16 = f0000000 90e60474 02f00000 0090e604
f1c73580 430230709 C Co:1:032:0 0 16 >
f1c73580 430233628 S Co:1:032:0 s 40 a0 10be 0000 0010 16 = e4f00000 00c209c2 0a120a9e d28190e6
f1c73580 430233710 C Co:1:032:0 0 16 >
f1c73580 430236657 S Co:1:032:0 s 40 a0 10ce 0000 0010 16 = 8ae4f090 e68bf002 14582009 0dc208d2
f1c73580 430236836 C Co:1:032:0 0 16 >
f1c73700 430239987 S Co:1:032:0 s 40 a0 10de 0000 0010 16 = 0a90eede 120ad702 145890de ad120ad7
f1c73700 430240086 C Co:1:032:0 0 16 >
f1c73780 430245409 S Co:1:032:0 s 40 a0 10ee 0000 0010 16 = 02145820 0910c208 120abed2 0a90eede
f1c73780 430246334 C Co:1:032:0 0 16 >
f1c73780 430249862 S Co:1:032:0 s 40 a0 10fe 0000 0010 16 = 120ad702 145890de ad120ad7 021458d2
f1c73780 430249960 C Co:1:032:0 0 16 >
f1c73780 430255178 S Co:1:032:0 s 40 a0 110e 0000 0010 16 = 0b90eede 120ad702 1458c20b 90eede12
f1c73780 430256352 C Co:1:032:0 0 16 >
f1c73e80 430259598 S Co:1:032:0 s 40 a0 111e 0000 0010 16 = 0ad70214 58300903 0211e2c2 0890e6ba
f1c73e80 430259710 C Co:1:032:0 0 16 >
f1c73e80 430264633 S Co:1:032:0 s 40 a0 112e 0000 0010 16 = e0faa3e0 fba3e0fc a3e0fd90 e00feaf0
f1c73e80 430264710 C Co:1:032:0 0 16 >
f1c73980 430272728 S Co:1:032:0 s 40 a0 113e 0000 0010 16 = a3ebf0a3 ecf0a3ed f090e601 74caf012
f1c73980 430273339 C Co:1:032:0 0 16 >
f1c73980 430277240 S Co:1:032:0 s 40 a0 114e 0000 0010 16 = 0abe90e0 0fe0faa3 e0fba3e0 fca3e0fd
f1c73980 430277337 C Co:1:032:0 0 16 >
f1c73e80 430280487 S Co:1:032:0 s 40 a0 115e 0000 0010 16 = c3ea9496 eb9400ec 9400ed94 00500890
f1c73e80 430280584 C Co:1:032:0 0 16 >
f1c73e80 430283203 S Co:1:032:0 s 40 a0 116e 0000 0010 16 = e60174ca f0800690 e601748a f090e032
f1c73e80 430283334 C Co:1:032:0 0 16 >
f1c73e80 430289555 S Co:1:032:0 s 40 a0 117e 0000 0010 16 = e0faa3e0 fba3e0fc a3e0fd90 e00fe0fe
f1c73e80 430290335 C Co:1:032:0 0 16 >
f1c73e80 430296287 S Co:1:032:0 s 40 a0 118e 0000 0010 16 = a3e0ffa3 e0f8a3e0 f9c3ea9e eb9fec98
f1c73e80 430297335 C Co:1:032:0 0 16 >
f1c73c00 430302759 S Co:1:032:0 s 40 a0 119e 0000 0010 16 = ed994004 d20a8033 90e032e0 faa3e0fb
f1c73c00 430302835 C Co:1:032:0 0 16 >
f1c73c00 430306408 S Co:1:032:0 s 40 a0 11ae 0000 0010 16 = a3e0fca3 e0fd90e0 0fe0fea3 e0ffa3e0
f1c73c00 430306585 C Co:1:032:0 0 16 >
f1c73c00 430310313 S Co:1:032:0 s 40 a0 11be 0000 0010 16 = f8a3e0f9 90e00fee c39af0ef 9ba3f0e8
f1c73c00 430310460 C Co:1:032:0 0 16 >
f1c73c00 430312833 S Co:1:032:0 s 40 a0 11ce 0000 0010 16 = 9ca3f0e9 9da3f0d2 06d20990 eede120a
f1c73c00 430312970 C Co:1:032:0 0 16 >
f1c73280 430320430 S Co:1:032:0 s 40 a0 11de 0000 0010 16 = d7021458 90dead12 0ad70214 58300903
f1c73280 430321339 C Co:1:032:0 0 16 >
f1c73480 430336482 S Co:1:032:0 s 40 a0 11ee 0000 0010 16 = 0212d190 e60174ca f0c20890 e6bae0fa
f1c73480 430337336 C Co:1:032:0 0 16 >
f1c73d00 430339423 S Co:1:032:0 s 40 a0 11fe 0000 0010 16 = a3e0fba3 e0fca3e0 fd90e00f eaf0a3eb
f1c73d00 430339459 C Co:1:032:0 0 16 >
f1c73480 430342449 S Co:1:032:0 s 40 a0 120e 0000 0010 16 = f0a3ecf0 a3edf090 e032e0fa a3e0fba3
f1c73480 430342588 C Co:1:032:0 0 16 >
f1c73c00 430345469 S Co:1:032:0 s 40 a0 121e 0000 0010 16 = e0fca3e0 fd90e00f e0fea3e0 ffa3e0f8
f1c73c00 430345584 C Co:1:032:0 0 16 >
f1c73680 430354521 S Co:1:032:0 s 40 a0 122e 0000 0010 16 = a3e0f9c3 ee9aef9b e89ce99d 5003120a
f1c73680 430355343 C Co:1:032:0 0 16 >
f1c73680 430377233 S Co:1:032:0 s 40 a0 123e 0000 0010 16 = be90e032 e0faa3e0 fba3e0fc a3e0fd90
f1c73680 430378339 C Co:1:032:0 0 16 >
f1c73680 430383729 S Co:1:032:0 s 40 a0 124e 0000 0010 16 = e00fe0fe a3e0ffa3 e0f8a3e0 f9c3ea9e
f1c73680 430383836 C Co:1:032:0 0 16 >
f1c73680 430388068 S Co:1:032:0 s 40 a0 125e 0000 0010 16 = eb9fec98 ed994004 d20a8033 90e032e0
f1c73680 430388210 C Co:1:032:0 0 16 >
f1c73680 430390508 S Co:1:032:0 s 40 a0 126e 0000 0010 16 = faa3e0fb a3e0fca3 e0fd90e0 0fe0fea3
f1c73680 430390585 C Co:1:032:0 0 16 >
f1c73680 430393526 S Co:1:032:0 s 40 a0 127e 0000 0010 16 = e0ffa3e0 f8a3e0f9 90e00fee c39af0ef
f1c73680 430393585 C Co:1:032:0 0 16 >
f1c73680 430399129 S Co:1:032:0 s 40 a0 128e 0000 0010 16 = 9ba3f0e8 9ca3f0e9 9da3f0d2 06d20990
f1c73680 430400335 C Co:1:032:0 0 16 >
f1c73680 430408471 S Co:1:032:0 s 40 a0 129e 0000 0010 16 = e00fe0fa a3e0fba3 e0fca3e0 fdc3ea94
f1c73680 430409340 C Co:1:032:0 0 16 >
f1c73680 430416164 S Co:1:032:0 s 40 a0 12ae 0000 0010 16 = 96eb9400 ec9400ed 94005008 90e60174
f1c73680 430417334 C Co:1:032:0 0 16 >
f1c73680 430424024 S Co:1:032:0 s 40 a0 12be 0000 0010 16 = caf08006 90e60174 8af090ee de120ad7
f1c73680 430424335 C Co:1:032:0 0 16 >
f1c73680 430426571 S Co:1:032:0 s 40 a0 12ce 0000 0010 16 = 02145890 dead120a d7021458 90e6bce0
f1c73680 430426710 C Co:1:032:0 0 16 >
f1c73680 430429489 S Co:1:032:0 s 40 a0 12de 0000 0010 16 = fa5302f0 90e02eea f0a3e4f0 a3f0a3f0
f1c73680 430429585 C Co:1:032:0 0 16 >
f1c73680 430434190 S Co:1:032:0 s 40 a0 12ee 0000 0010 16 = 746f5580 fa90e6bc e0fb7490 5b4af580
f1c73680 430434336 C Co:1:032:0 0 16 >
f1c73680 430442701 S Co:1:032:0 s 40 a0 12fe 0000 0010 16 = 90eede12 0ad70214 58740f55 80fa90e0
f1c73680 430443336 C Co:1:032:0 0 16 >
f1c73680 430449481 S Co:1:032:0 s 40 a0 130e 0000 0010 16 = 2ee0fba3 e0fca3e0 fda3e0fe e4fff8f9
f1c73680 430450338 C Co:1:032:0 0 16 >
f1c73680 430454183 S Co:1:032:0 s 40 a0 131e 0000 0010 16 = ea4203ef 4204e842 05e94206 8b8090ee
f1c73680 430454338 C Co:1:032:0 0 16 >
f1c73680 430457177 S Co:1:032:0 s 40 a0 132e 0000 0010 16 = de120ad7 02145874 6f5580fa 90e02ee0
f1c73680 430457337 C Co:1:032:0 0 16 >
f1c73680 430459964 S Co:1:032:0 s 40 a0 133e 0000 0010 16 = fba3e0fc a3e0fda3 e0fe5303 907c007d
f1c73680 430460092 C Co:1:032:0 0 16 >
f1c73680 430463197 S Co:1:032:0 s 40 a0 134e 0000 0010 16 = 007e00e4 fff8f9ea 4203ef42 04e84205
f1c73680 430463340 C Co:1:032:0 0 16 >
f1c73680 430466171 S Co:1:032:0 s 40 a0 135e 0000 0010 16 = e942068b 8090eede 120ad702 1458749f
f1c73680 430466337 C Co:1:032:0 0 16 >
f1c73680 430469220 S Co:1:032:0 s 40 a0 136e 0000 0010 16 = 5580fa90 e02ee0fb a3e0fca3 e0fda3e0
f1c73680 430469342 C Co:1:032:0 0 16 >
f1c73980 430474179 S Co:1:032:0 s 40 a0 137e 0000 0010 16 = fe530360 7c007d00 7e00e4ff f8f9ea42
f1c73980 430474335 C Co:1:032:0 0 16 >
f1c73980 430477277 S Co:1:032:0 s 40 a0 138e 0000 0010 16 = 03ef4204 e84205e9 42068b80 90eede12
f1c73980 430477463 C Co:1:032:0 0 16 >
f1c73980 430479971 S Co:1:032:0 s 40 a0 139e 0000 0010 16 = 0ad70214 5890e68a e4f090e6 8bf090e6
f1c73980 430480090 C Co:1:032:0 0 16 >
f1c73980 430482984 S Co:1:032:0 s 40 a0 13ae 0000 0010 16 = a0e0fa20 e1f890e7 40e0faa3 e0fba3e0
f1c73980 430483085 C Co:1:032:0 0 16 >
f1c73980 430489661 S Co:1:032:0 s 40 a0 13be 0000 0010 16 = fca3e0fd 90e003ea f0a3ebf0 a3ecf0a3
f1c73980 430490344 C Co:1:032:0 0 16 >
f1c73980 430498870 S Co:1:032:0 s 40 a0 13ce 0000 0010 16 = edf090e7 44e0faa3 e0fba3e0 fca3e0fd
f1c73980 430499337 C Co:1:032:0 0 16 >
f1c73980 430501894 S Co:1:032:0 s 40 a0 13de 0000 0010 16 = 90e007ea f0a3ebf0 a3ecf0a3 edf090e0
f1c73980 430501963 C Co:1:032:0 0 16 >
f1c73880 430504913 S Co:1:032:0 s 40 a0 13ee 0000 0010 16 = 03e0faa3 e0fba3e0 fca3e0fd baff0bbb
f1c73880 430505087 C Co:1:032:0 0 16 >
f1c73880 430508168 S Co:1:032:0 s 40 a0 13fe 0000 0010 16 = ff08bcff 05bdff02 8012d204 746f5580
f1c73880 430508337 C Co:1:032:0 0 16 >
f1c73880 430510877 S Co:1:032:0 s 40 a0 140e 0000 0010 16 = fa90e6bc e0fb7490 5b4af580 90e007e0
f1c73880 430510959 C Co:1:032:0 0 16 >
f1c73100 430513904 S Co:1:032:0 s 40 a0 141e 0000 0010 16 = faa3e0fb a3e0fca3 e0fdbaff 0bbbff08
f1c73100 430514090 C Co:1:032:0 0 16 >
f1c73f00 430516939 S Co:1:032:0 s 40 a0 142e 0000 0010 16 = bcff05bd ff028012 d205749f 5580fa90
f1c73f00 430517095 C Co:1:032:0 0 16 >
f1c73f80 430519895 S Co:1:032:0 s 40 a0 143e 0000 0010 16 = e6bce0fb 74605b4a f58090e6 8ae4f090
f1c73f80 430519968 C Co:1:032:0 0 16 >
f1c73f00 430522900 S Co:1:032:0 s 40 a0 144e 0000 0010 16 = e68bf080 05740124 ff22e424 ff22758c
f1c73f00 430523094 C Co:1:032:0 0 16 >
f1c73f80 430527477 S Co:1:032:0 s 40 a0 145e 0000 0010 16 = d1758a4a 74f05589 4401f589 438e08d2
f1c73f80 430527590 C Co:1:032:0 0 16 >
f1c73880 430529922 S Co:1:032:0 s 40 a0 146e 0000 0010 16 = 8cd2a9d2 af22c0e0 c082c083 c002c003
f1c73880 430530093 C Co:1:032:0 0 16 >
f1c73880 430532941 S Co:1:032:0 s 40 a0 147e 0000 0010 16 = c004c005 c006c007 c000c001 c0d075d0
f1c73880 430533344 C Co:1:032:0 0 16 >
f06d8580 430536175 S Co:1:032:0 s 40 a0 148e 0000 0010 16 = 00758cd1 758a4a90 e032e024 01f0a3e0
f06d8580 430536217 C Co:1:032:0 0 16 >
f06d8580 430538902 S Co:1:032:0 s 40 a0 149e 0000 0010 16 = 3400f0a3 e03400f0 a3e03400 f030041e
f06d8580 430538963 C Co:1:032:0 0 16 >
f06d8100 430541937 S Co:1:032:0 s 40 a0 14ae 0000 0010 16 = 90e003e0 faa3e0fb a3e0fca3 e0fd90e0
f06d8100 430542087 C Co:1:032:0 0 16 >
f06d8100 430545115 S Co:1:032:0 s 40 a0 14be 0000 0010 16 = 26eaf0a3 ebf0a3ec f0a3edf0 c2043005
f06d8100 430545214 C Co:1:032:0 0 16 >
f06d8100 430547967 S Co:1:032:0 s 40 a0 14ce 0000 0010 16 = 1e90e007 e0faa3e0 fba3e0fc a3e0fd90
f06d8100 430548089 C Co:1:032:0 0 16 >
f06d8f80 430551164 S Co:1:032:0 s 40 a0 14de 0000 0010 16 = e02aeaf0 a3ebf0a3 ecf0a3ed f0c20590
f06d8f80 430551210 C Co:1:032:0 0 16 >
c2f05300 430554270 S Co:1:032:0 s 40 a0 14ee 0000 0010 16 = e026e0fa a3e0fba3 e0fca3e0 fd90e026
c2f05300 430554338 C Co:1:032:0 0 16 >
c2f05300 430556980 S Co:1:032:0 s 40 a0 14fe 0000 0010 16 = e024fffe a3e034ff ffa3e034 fff8a3e0
c2f05300 430557093 C Co:1:032:0 0 16 >
c2f05500 430560020 S Co:1:032:0 s 40 a0 150e 0000 0010 16 = 34fff990 e026eef0 a3eff0a3 e8f0a3e9
c2f05500 430560090 C Co:1:032:0 0 16 >
c2f05500 430562946 S Co:1:032:0 s 40 a0 151e 0000 0010 16 = f0ea4b4c 4d702e74 6f5580fa 90e02ee0
c2f05500 430563090 C Co:1:032:0 0 16 >
f2837e00 430566168 S Co:1:032:0 s 40 a0 152e 0000 0010 16 = fba3e0fc a3e0fda3 e0fe5303 907c007d
f2837e00 430566344 C Co:1:032:0 0 16 >
f2837e00 430568898 S Co:1:032:0 s 40 a0 153e 0000 0010 16 = 007e00e4 fff8f9ea 4203ef42 04e84205
f2837e00 430568964 C Co:1:032:0 0 16 >
f2837e00 430572163 S Co:1:032:0 s 40 a0 154e 0000 0010 16 = e942068b 8090e02a e0faa3e0 fba3e0fc
f2837e00 430572211 C Co:1:032:0 0 16 >
f2837e00 430575300 S Co:1:032:0 s 40 a0 155e 0000 0010 16 = a3e0fd90 e02ae024 fffea3e0 34ffffa3
f2837e00 430575339 C Co:1:032:0 0 16 >
f2837e00 430577971 S Co:1:032:0 s 40 a0 156e 0000 0010 16 = e034fff8 a3e034ff f990e02a eef0a3ef
f2837e00 430578089 C Co:1:032:0 0 16 >
f2837e00 430580925 S Co:1:032:0 s 40 a0 157e 0000 0010 16 = f0a3e8f0 a3e9f0ea 4b4c4d70 2e749f55
f2837e00 430581089 C Co:1:032:0 0 16 >
d907cb80 430584176 S Co:1:032:0 s 40 a0 158e 0000 0010 16 = 80fa90e0 2ee0fba3 e0fca3e0 fda3e0fe
d907cb80 430584335 C Co:1:032:0 0 16 >
d907cb80 430586965 S Co:1:032:0 s 40 a0 159e 0000 0010 16 = 5303607c 007d007e 00e4fff8 f9ea4203
d907cb80 430587088 C Co:1:032:0 0 16 >
d907cb80 430589902 S Co:1:032:0 s 40 a0 15ae 0000 0010 16 = ef4204e8 4205e942 068b8010 0602801c
d907cb80 430589962 C Co:1:032:0 0 16 >
d907c580 430593161 S Co:1:032:0 s 40 a0 15be 0000 0010 16 = 90e00fe0 faa3e0fb a3e0fca3 e0fd90e0
d907c580 430593214 C Co:1:032:0 0 16 >
d907c580 430596161 S Co:1:032:0 s 40 a0 15ce 0000 0010 16 = 0beaf0a3 ebf0a3ec f0a3edf0 30080b90
d907c580 430596213 C Co:1:032:0 0 16 >
d907c580 430598902 S Co:1:032:0 s 40 a0 15de 0000 0010 16 = e00be4f0 a3f0a3f0 a3f03009 3c90e00b
d907c580 430598964 C Co:1:032:0 0 16 >
d907c580 430602162 S Co:1:032:0 s 40 a0 15ee 0000 0010 16 = e0faa3e0 fba3e0fc a3e0fdea 4b4c4d70
d907c580 430602209 C Co:1:032:0 0 16 >
d907ce80 430605162 S Co:1:032:0 s 40 a0 15fe 0000 0010 16 = 04d20a80 2490e00b e024fffa a3e034ff
d907ce80 430605213 C Co:1:032:0 0 16 >
f482ee00 430608164 S Co:1:032:0 s 40 a0 160e 0000 0010 16 = fba3e034 fffca3e0 34fffd90 e00beaf0
f482ee00 430608211 C Co:1:032:0 0 16 >
f482ee80 430610917 S Co:1:032:0 s 40 a0 161e 0000 0010 16 = a3ebf0a3 ecf0a3ed f0d0d0d0 01d000d0
f482ee80 430610963 C Co:1:032:0 0 16 >
f0569600 430613941 S Co:1:032:0 s 40 a0 162e 0000 0010 16 = 07d006d0 05d004d0 03d002d0 83d082d0
f0569600 430614966 C Co:1:032:0 0 16 >
f482e200 430618901 S Co:1:032:0 s 40 a0 163e 0000 0002 2 = e032
f482e200 430618961 C Co:1:032:0 0 2 >
f1d79000 430622933 S Co:1:032:0 s 40 a0 173a 0000 0001 1 = 0a
f1d79000 430623094 C Co:1:032:0 0 1 >
f1d79900 430627052 S Co:1:032:0 s 40 a0 1640 0000 0010 16 = 300d0a90 e680e0fa 440af080 0890e680
f1d79900 430627220 C Co:1:032:0 0 16 >
f1d79900 430629909 S Co:1:032:0 s 40 a0 1650 0000 0010 16 = e0fa4408 f09005dc 12167390 e65d74ff
f1d79900 430629963 C Co:1:032:0 0 16 >
f1d79580 430632930 S Co:1:032:0 s 40 a0 1660 0000 0010 16 = f090e65f 74fff053 91ef90e6 80e0fa54
f1d79580 430633091 C Co:1:032:0 0 16 >
f1d79580 430636194 S Co:1:032:0 s 40 a0 1670 0000 0003 3 = f7f022
f1d79580 430636336 C Co:1:032:0 0 3 >
f1d79580 430639192 S Co:1:032:0 s 40 a0 02f5 0000 0006 6 = e478fff6 d8fd
f1d79580 430639338 C Co:1:032:0 0 6 >
f1d79580 430642176 S Co:1:032:0 s 40 a0 02d3 0000 0010 16 = 791ce944 00601b7a 0190171f 782675a0
f1d79580 430642343 C Co:1:032:0 0 16 >
f1d79580 430644958 S Co:1:032:0 s 40 a0 02e3 0000 0010 16 = e0e493f2 a308b800 0205a0d9 f4daf275
f1d79580 430645088 C Co:1:032:0 0 16 >
c2f17100 430648162 S Co:1:032:0 s 40 a0 02f3 0000 0002 2 = a0ff
c2f17100 430648210 C Co:1:032:0 0 2 >
c2f17800 430650919 S Co:1:032:0 s 40 a0 02fb 0000 0010 16 = 7800e844 00600a79 0075a000 e4f309d8
c2f17800 430650965 C Co:1:032:0 0 16 >
c2f17980 430658286 S Co:1:032:0 s 40 a0 030b 0000 0010 16 = fc7826e8 4400600c 790190e0 00e4f0a3
c2f17980 430659337 C Co:1:032:0 0 16 >
f0686b80 430668184 S Co:1:032:0 s 40 a0 031b 0000 0004 4 = d8fcd9fa
f0686b80 430669340 C Co:1:032:0 0 4 >
f0686700 430672700 S Co:1:032:0 s 40 a0 1673 0000 0010 16 = aa82ab83 90e600e0 fc530418 bc001174
f0686700 430672837 C Co:1:032:0 0 16 >
f0686980 430683184 S Co:1:032:0 s 40 a0 1683 0000 0010 16 = 012afce4 3bfd8c02 c313ca13 cafb8012
f0686980 430683340 C Co:1:032:0 0 16 >
f0686980 430685696 S Co:1:032:0 s 40 a0 1693 0000 0010 16 = 90e600e0 fc530418 bc1007eb ca25e0ca
f0686980 430685836 C Co:1:032:0 0 16 >
f0686980 430688640 S Co:1:032:0 s 40 a0 16a3 0000 0010 16 = 33fb8a04 8b051aba ff011bec 4d600dc0
f0686980 430688711 C Co:1:032:0 0 16 >
f0686980 430691664 S Co:1:032:0 s 40 a0 16b3 0000 000d 13 = 02c00312 16c0d003 d00280e6 22
f0686980 430691712 C Co:1:032:0 0 13 >
f0686980 430694690 S Co:1:032:0 s 40 a0 02c6 0000 000d 13 = 75817f12 16d1e582 60030203 2e
f0686980 430694840 C Co:1:032:0 0 13 >
f0686280 430698804 S Co:1:032:0 s 40 a0 16c0 0000 0010 16 = 7400f586 90fda57c 05a3e582 458370f9
f0686280 430698967 C Co:1:032:0 0 16 >
c2689180 430701316 S Co:1:032:0 s 40 a0 16d0 0000 0005 5 = 22758200 22
c2689180 430701469 C Co:1:032:0 0 5 >
c2689180 430711722 S Co:1:032:0 s 40 a0 7f92 0000 0001 1 = 01
c2689180 430712346 C Co:1:032:0 0 1 >
c2689180 430714740 S Co:1:032:0 s 40 a0 e600 0000 0001 1 = 01
c2689180 430714836 C Co:1:032:0 0 1 >
c2689180 430717770 S Co:1:032:0 s 40 a0 7f92 0000 0001 1 = 00
c2689180 430717837 C Co:1:032:0 0 1 >
c2689180 430720707 S Co:1:032:0 s 40 a0 e600 0000 0001 1 = 00
c2689180 430720837 C Co:1:032:0 0 1 >
